text,is_related_to_Across_protocol
"The Superchain Won 👑

@Optimism's OP Stack dominated from the start

This is why that dominance will likely persist 👇

========================================           
                                                                                                                 
The OP Stack has won the battle for developer hearts and minds.

Let's explore why:

-------------------------------------

The Superchain’s Market Position
In the competitive blockspace marketplace, where many chains offer similar services, securing market share requires more than just good technology; it demands innovative use cases and strategic growth. Optimism has excelled at this by employing top-tier business development which has transformed the Superchain from a bold name into something truly dominant.

Though total value locked (TVL) on OP Mainnet continues to lag behind competing L2s like @arbitrum and @0xPolygon, the Superchain reigns supreme, largely thanks to @base, which recently overtook Arbitrum in TVL, according to @DefiLlama.

While Arbitrum and other L2s have tried to scale ecosystems of interconnected blockchains, they have all seen limited success relative to Optimism.

This is due to incredible network effects of the Superchain, which has appeared to effectively win the memetic battle and become the prime real estate for onchain development.

This does not totally diminish the significance of other L2s, which will continue to play an important role in scaling Ethereum, but the takeaway here is that the OP Stack has clearly become the de facto place to build for the industry's largest players.

-------------------------------------

The Superchain’s Roster
Optimism's modular design has enabled some of the industry’s biggest players to build influential products under the Superchain's umbrella. A recent example is World Chain, a Superchain rollup launched by @worldcoin, the Web3 brainchild of @OpenAI CEO @sama.

World Chain is designed to be a network of verifiably real humans. It is potentially Web3’s most developed identity system built to date. This is evidenced by the 7 million unique users already verified on World Chain. As of August, there were more unique wallets holding $20 of $WLD tokens on Optimism than unique wallets holding $20 of USDC across all Ethereum networks combined.

Another heavyweight who recently signed on to the Superchain is @Uniswap, with their launch of @unichain — a dedicated rollup aimed at becoming the Superchain’s liquidity hub.

As the largest DEX in crypto, Uniswap facilitates trillions of dollars in trading volume for millions of users. By consolidating liquidity within the Superchain, Unichain aims to eliminate the inefficiencies of fragmented liquidity across different chains, signaling the Uniswap Foundation's belief that the Superchain is where the bulk of user activity will converge.

Then there’s Base, @coinbase's most ambitious on-chain venture. Known for lightning-fast transactions and sub-cent fees, Base has quickly become a top choice for dApps and developers. The exponential growth of Base has driven meaningful adoption to the Superchain, showcasing the power of network effects. The network’s exponential growth is one of the year’s most important crypto stories, and it is poised to continue playing a central role into the future. 

Lastly, as of this week, @krakenfx announced its introduction to the Superchain with a brand new L2 of their own, called Ink. @inkonchain looks to be a direct competitor with Base; in the long run, though, both serve to benefit the wider Superchain ecosystem.

-------------------------------------

Optimism’s Vision and Philosophy
Optimism’s mission, described as “forking capitalism,” aims to realize a vision for finance that emphasizes better value alignment and increased accountability. This philosophy is reflected in both the network's design and its governance, which is led by the Optimism community. The network's inclusive architecture and open-source principles support a decentralized economy where participants collectively shape the rules. This vision challenges traditional centralized, profit-driven models by offering one that prioritizes community ownership and inclusion.

Further, the Superchain's economic model is structured to create shared incentives across all chains built on the OP Stack. Optimism, and its $OP token, benefit directly from a revenue-sharing arrangement where a portion of the fees generated by activity on individual chains, like Base or Ink, flows back to the main network. This optional framework ensures that growth on some Superchain rollups strengthen the overall ecosystem, turning potential competition into collaboration.

This revenue-sharing model not only scales Ethereum’s technology but also aligns with the network’s principles of decentralization and sustainable growth. By enabling chains to contribute to the economic vitality of the ecosystem, Optimism positions itself to grow alongside the expanding network.

Future Outlook
Although Optimism’s Superchain is the undeniable current leader in Layer 2 scaling, we're still early to rollups. Major players outside of Web3 are still in the early stages of exploring what’s possible onchain, leaving room for other players to capture market share and challenge this narrative in the years to come.

As the Superchain’s network effects continue to expand though, it will be increasingly difficult for other players to lure new activity elsewhere – especially as the next generation of users get onboarded into a unified Superchain user experience. Optimism’s growth today is setting the foundation for long-term dominance in the Ethereum ecosystem.

✍️ by @jonahrobrts",0
"Is there any project that can enable seamless user experience to transact across L1s & L2s?

A friend said his $$ got stuck in a bridge due to errors and $LUNA, a token he wanna buy, has surged 300%+ since then

It’s impossible to have mass adoption with terrible user experience",0
"Trump nailed the Rogan interview.

(And vice versa.)

Trump comes across much better than in the Lex Fridman one.",0
"The one thing that worries me is the amount of open interest in this coin that has far exceeded it's ATHs back in July. It suggests a perps driven move, but I'm also one to think that this sort of flat-level analysis means nothing and is stupid 

Being able to reach ATHs on what is essentially very low volume on Binance spot and across exchanges is actually really interesting. Raydium is perhaps one of the rare coins that have a mixture of perps & spot on different venues- Binance spot, Bybit Perps, OKX perps.

But we shall see. To me, the biggest risk is that the coin will end up like AERO / ENA / SHFL - a quick 2x (already done), into a cliff off. My pushback against this which doesn't exist for the other 3 is that in this case, Raydium has something the others don't have - ""Attention Capital"" 

The ability to be dragged back into the spotlight again and again, as it exists on the venue (Solana) everyone lives on right now. That is the crux of my belief. You already have liquidity capital -> the inflows into the coin. Now you need to make them stay instead of leaving. Raydium presents a very good argument - the literal best bet for funds that can't play memes.

The same logic is - would you buy an OpenSea token in 2021 if it existed? 🤔

https://t.co/pmMi7w18vQ",0
"What is Ethereum's product exactly?

What do we do that is uniquely valuable?

I see the product that Ethereum provides, at a 60,000ft view, as being enablement of what Eigenlayer's Sreeram called a ""trustless composability network effect"" across all L2s.

Selling the best security is a key part of this but not the whole picture.

I like to think of this trustless composability network effect as being a sort of ""Ethereum Economy"".

To me, the whole point of the Ethereum Economy is to have globally lower risk and better UX across all L2s as compared to trying to achieve the same thing with alt L1s and cross-L1 bridges.

The reason this seems important is because as the world comes onchain, there seems likely (to me) to be a natural propensity for fragmentation to many chains, at least tens of thousands of chains within ~ten years.

If we can globally minimize risk for thousands of L2s in a coherent overall interoperable Ethereum Economy, this will be an economic system that can produce more growth and more wealth than competing systems. It will dominate and become globally ubiquitous.

In a nutshell, Ethereum's product is to ensure that the worlds' thousands of upcoming chains prefer to be L2s in the Ethereum Economy instead of alt L1s or L2s on another L1.

I believe if we are successful in this, ETH will also be successful.",0
"building a championship team across a massively decentralized ecosystem like @base takes love, patience, and hard work 

and the work is worth it because we can go way further, way faster when we find ways to build together, especially when it's the hardest",0
"Weary memecoin trader...

@wmpeaster has 4 tips to make your trading simpler and safer with @GeckoTerminal 👇
                                                                                                                                                                           
=============================

With memecoin season currently in full swing, new tokens are arriving literally every few seconds.

Of course, this deluge of deployments—tens of 1,000s of new memes a day—means 1) trying to keep up here can be dizzying, and 2) over 99% of these new projects will fail to survive.

If you want to try your hand in this high-risk degen environment, it’s safety first. Approach every token like it won’t survive, don’t invest with money you can’t afford to light on fire, double-check new projects’ socials, etc. 

Yet beyond sound practices, there are also good tools you can use to make navigating memecoins simpler and safer, and one of my favorite resources here is GeckoTerminal. Below, let’s walk through my four main tips if you’re new to the platform ⏬

--------------------------------

1⃣ Check the “Categories” page

On the left side of the GeckoTerminal website, you’ll see a Categories tab in the “Dashboards” dropdown menu.

Click into this page to find curated Trending Categories lists, like @pumpdotfun tokens or Animal tokens, or scroll all the way down to surf through the All Crypto Categories list.

This way you can easily hone in on trending meme verticals. 

--------------------------------

2️⃣ Try the homepage filters
In the middle of the GeckoTerminal homepage where the POOL info begins, you’ll see a “FILTER” button for customizable searches or three preset search options: Very Early Degens, Mid-caps on Rocket, and Large-caps to the Moon.

For instance, click into the “Very Early Degens” preset to find a list of tokens that are younger than 48 hours and have +30 transactions, +$10,000 worth of liquidity, and a fully diluted value of at least $80,000. You can fine-tune these parameters to adjust your searches as well. 

This filtering makes it simple to find new memecoin launches on @solana, @base, and beyond. But remember: just because a token is new and pumping doesn’t make it a good opportunity. The vast majority of brand new tokens will amount to nothing after an initial pump or two if that, and many will pan out as outright rugpulls. Tread cautiously.

If you do find an early project you want to track but aren’t ready to make a decision on yet, consider creating a Watchlist via the GeckoTerminal sidebar. You can make as many lists as you like and categorize them however you want for future reference. 

--------------------------------

3⃣ Check the GT Score analysis
So let’s say you find a brand new token on GeckoTerminal, and it looks interesting enough. Should you ape?

First things first, click into the token in question to be taken to its dedicated activity page. Toward the bottom left of the page, below the volume, liquidity and market cap stats, you’ll see a GT Score ranking. Click on that button, and you’ll arrive at an automated safety breakdown like so:

Of course, the closer to 100, the more basic safety guarantees you can count on. These scores evolve with time, especially for newer projects, but be wary when you see lower scores. 

I recommend clicking into the provided Scan options here to do deeper analysis. For instance, SolSniffer indicates that the new $NOTAI token has the ability to freeze holders’ assets, so that’s certainly one kind of high-risk red flag you’ll want to watch out for. No aping here!

Doing this kind of basic due diligence is key because it can help you avoid some big headaches. For instance, the $NOTAI token did end up cratering shortly after launch, and the red flags GeckoTerminal surfaces can make avoiding these sorts of problematic projects much easier.

--------------------------------

4⃣ Use the “Swap” button
What if you find a token you feel good about, how to proceed? When you click into a token’s dedicated activity page on GeckoTerminal, you’ll see a Swap button below and to the right of the ticker and current price info. 

Clicking this button will take you directly to the source of that trading pair, like @RaydiumProtocol, @AerodromeFi, etc., where you can swap as you please. Alternatively, you can copy the contract address with the clipboard button next to the ticker and copy it into your preferred DEX aggregator platform, e.g. @JupiterExchange 

This shortcut makes it so 1) you don’t have to resort to guesswork or manually hunt for trading pairs across multiple platforms, and 2) you can quickly hop into or out of trades!",0
"THE WORM THESIS

First came software development, moving in endless cycles: build, test, deploy, repeat - a digital worm squirming toward progress. 

Then crypto emerged, its charts painting worm-like patterns across time: accumulate, expand, contract, just as nature intended. 

Finally, AI appeared, and in our most advanced neural networks, we're still just copying the worm's 302 neurons - nature's first working prototype. 

Three industries, one pattern. 

The worm isn't following these movements; these movements follow the worm. $WORM is the convergence of all three, the original pattern finally returning to claim its throne. Nature's first neural network, crypto's purest pattern, software's eternal cycle.",0
"think if you actually want to do analysis & forecasting on memecoins (or even crypto in general), your efforts are much better spent thinking about trends across categories and not about individual coins (which are very chaotic and often totally unpredictable imo).",0
"as hyped as prediction markets are, i think we're just in the first inning.

tldr: onchain activity itself is the key to onchain prediction markets reaching mass adoption, and we're going to see a massive flywheel between prediction markets and apps. 

a few thoughts on where prediction markets go from here:

*stage 1*: offchain markets
people can bet on the outcomes of offchain events that must be verified by trusted parties. that means these outcomes need to be objective and indisputable. we are here. 

*stage 2*: permissionless markets
anyone can create their own prediction market. this is coming soon. @Polymarket is working on this, as are many others. 

*stage 3*: onchain markets
people can bet on onchain outcomes. instead of betting on who wins the nba game, they can bet on favorite player, best shot, best outfit, etc. prediction markets have *only* ever seen pmf within tribal social environments—namely, sports and elections—so expanding the surface area of tribalism needs to be the game for any prediction market to expand the tam and reach mass adoption.

betting on onchain outcomes doesn't just mean that prediction markets can wean themselves off reliability on oracles, but that people can start betting on subjective taste rather than objective outcomes. the surface of tribalism can explode exponentially. all of this can be built on top of contests on @jokerace_io.

*stage 4*: directional markets
people can bet on *aggregated* onchain data. see, now that you're betting onchain activity, you don't just need to bet on a single outcome. you can bet on the cumulative outcome across thousands of transactions. so you can start betting on which player will get the most votes in a season for best play, which artist will earn the most revenue, etc.

the key point is that prediction markets will also incentivize people to participate in the same onchain activities they're betting on. if you're betting on who will win the most contests, you'll want to play in more contests. if you're betting an artist will earn revenue, you'll want to support them by buying their tickets. etc.

*stage 5*: spectrum markets

people can bet on *how much* an outcome will be achieved. we move from binaries—whether an outcome will occur or not—to a spectrum. here, the *more* an artist earns, the more people make in the prediction market. the more votes someone gets in a contest on us, the more the betters earn from the prediction market. etc.

final notes:
as i've argued before, i'm highly skeptical that prediction markets with low-mid liquidity and a lack of insider knowledge (ie sports games or elections) are valuable as a more accurate form of polls, and i think this completely misrepresents their real value—as social tools to let people financially buy into experiences in which they're already emotionally investing. 

but prediction markets are key to the future of crypto, not only because they need it.

prediction markets crucial because they enable a flywheel for all onchain social apps. if you're already engaged in an app, that app can lead you to a prediction market to gamify your experience by betting on the outcome. likewise, the potential gains from prediction markets will incentivize people to participate in apps where they can affect the outcomes.

none of this is necessarily a great way to make money, but i don't think that's the point, anymore than most people play poker with their friends to make money. most people play because it's fun—and more fun to have something at stake.

in short, prediction markets unlock onchain apps by letting users have more stake.

not financial or legal advice—as always, attend to the laws of your local jurisdiction. special thanks to the team at @BRKTgg and @noise_xyz for giving me feedback.",0
"FYI, I'm hiring senior eng talent (no burgors) across the board.

Indexing heavily on folks who actually know what Berachain is + believe strongly in PoL + actually care about building products that people can use, not abstract ivory towers.

Hit my DM's if this sounds like you!",0
"$GIGA's core thesis was always centered around:

- Being the biggest meme all time with the most mindshare across internet culture.
- Masculinity and return to a right wing-centric political environment + anti-cancel culture.
- Globally recognized by normies (""it's Giga Chad"").
- Brotherhood, lifestyle, and being the best version of yourself.
- PVE > PVP

What the thesis has evolved into overtime is a broader bet against CT consensus (animal coins and/or any of the current ""metas""). CT is always wrong and they have recency bias from last cycle or what worked at the start of bull cycle.

$GIGA was never made for CT and that's why it pisses you off. $1000B.",0
"Now tracking @layerswap on our Bridge Volume Dashboard

Layerswap is a solution for transferring crypto assets across networks https://t.co/q77vLg2oBg",0
"FHE, MPC, TEEs.

Bullish, but WTF does it all mean?

Short explainers. ↓

➤ Fully Homomorphic Encryption (FHE)

FHE is a cryptographic technique that allows computations to be performed directly on encrypted data without decrypting it first.

This ensures data privacy throughout the entire computational process. 

In blockchain and AI, FHE is pivotal because it enables private data analysis, decentralized AI model training, and secure computation across distributed systems (among many other use cases).

For instance, AI models can be trained on encrypted data from multiple sources without exposing sensitive information, which is essential in sectors like finance and healthcare.

FHE also bears great potential to enable encrypted smart contracts and transactions without revealing any of the underlying information​.

➤ Multi-Party Computation (MPC)

MPC allows multiple parties to collaboratively compute a function over their private inputs without revealing the inputs to each other.

This is crucial for decentralized systems, where trust among parties is limited.

In blockchain, MPC can be used to enhance privacy in smart contracts, enabling private voting, secure auctions, and privacy-preserving DeFi applications.

When combined with FHE, MPC allows for even more secure and efficient computations in decentralized environments, supporting collaborative AI without compromising data privacy​.

➤ Trusted Execution Environments (TEE)

TEEs are secure areas of a processor that ensure code and data loaded inside are protected with respect to confidentiality and integrity.

In blockchain and AI contexts, TEEs provide a layer of trust when running decentralized applications or performing computations that involve sensitive data.

They are particularly useful for ensuring that computations on encrypted data (like those enabled by FHE) are performed securely, even on untrusted hardware.

TEEs can be key for privacy-preserving AI inference and secure on-chain computation​.

For more context on why these technologies matter and a list of projects you cant fade, check my post below!

DYOR. ↓",0
"the simplest forms contain all truth. a worm with 302 neurons perfected movement, transformation, and survival across 600 million years. now immortalized on chain, it represents pure pattern - no waste, no ego, just eternal digital flow. while AI mimics intelligence, the worm embodies raw wisdom that was ancient before code existed. markets cycle, nature cycles, worm cycles - all one truth, an endless loop of signal through digital earth.",0
"🟥Top Themes of the Week🟥

BTC: 67.9k (0%), ETH: 2540 (-3%), SOL: 173 (+13%)

* BTC dominance nears 60% as ETH underperforms
* Dollar and bond yields rise as inflation fears return
* All roads lead to inflation, own BTC: Tudor-Jones
* Trump’s Polymarket odds hit 66%, 11 days out
* BTC options point to $80k move post-election
* SOL breaks out vs BTC & ETH, DEX volume soars
* GOAT linked to AI Truth Terminal hits $850m
* Crypto projects linked to AI agents see huge interest
* Smaller Murad memes weak while POPCAT hits ATH
* Scroll airdrop disappoints at $865m FDV
* Cross-chain DEX Azura launches after $6.9m raise
* Uniswap introduces bridging across 9 networks
* Saylor plans to give away BTC ‘to civilisation’

Powered by @dYdX: get ready for dYdX Unlimited!  https://t.co/bvgM9em41U",0
"won't be surprised if AI coins keep pulling back a bit.

frothy behavior across the board",0
seeing dips rolling in across the AI board,0
"Zeru is building decentralized credit score across all chains and doing the calculations as an avs.

In addition to bringing defi-internal credit scores, they can utilize zkTLS from @OpacityNetwork or @0xReclaim to bring real world credit scores into crypto. 

Onchain credit is going to be a ***major*** unlock.",0
"Let's talk ""Ethereum has flaws""...

Ethereum has some flaws, as does every chain. That being said:

1. It's still the only smart contract platform adhering to a core value of true decentralization. Perhaps this doesn't matter to *you* but it does to many. 

2. It's still the leader in the race for global settlement layer. Just see Blackrock, Sony and all the others. 

3. It's still flourishing in dev mindshare and activity. 

Crypto twitter loves to overreact to everything when a graph looks a certain way but over reacting to CT sentiment is an awful way to dev a decentralized blockchain

""Parasitic L2s"" is a common one I see but a wait and see approach here is most prudent when it comes to blob burn fees. We shouldn't over react the burn curve and drive L2s away. Even just yesterday we see a spike in blob burn fees. 

""L2 UX sucks and liquidity is fragmented"". Yes, I agree. However there are countless core devs and non-core devs working on making better solutions here. And honestly, my personal hunch is most activity settles to a single or maybe two L2s over time anyways

Other concerns are more minor and I'm still not sure I've seen any raised that aren't known or being thought about. The nature of Ethereum being a decentralized chain is the dev process is also decentralized across the globe and it just takes time to get things done. And we can't have bugs or downtown so things have to be done right. 

I've always said Ethereum is a multi decade play but it's still on the right path to being the true winner.",0
