text,is_related_to_Across_protocol
"Heuristic of making money on memes:

Memes act  closely to a monetary asset - increase in liquidity and agreement on social consensus leading to buy in hope of much higher- leading to higher market caps

The game unlike money though is that - one does not want to save in memes - they want to buy only in order to sell

So how the game is played is very large price predictions that are above reasonable- buying low as possible and then Kols selling for 50-100x - 10-20% of the way to their public target in order to entice the last person in that it can still go higher

Listen to what Murad/Ansem actually says and does and where all the real money has been made in memes - it has not been made buying billion dollar plus memes - its made buying sub 100m MC and them moving to the billions where the price target is tens of billions

Across a portfolio you wont make money in aggregate buying 3-5bn MC memes because winners wont cover for losers and % gains arent big enough to make a difference when you factor execution - might aswell just own bitcoin and not worry about it as when you factor execution alts in general need to do 3x more in btc to get same result in the end

All the winners you can name in Crypto who made a killing didnt go all in on memes - they put a small % in but the meme went from 10m to 500m-1bn etc and now its majority of their port but it didnt start that way - thats where the money is made

Hence if you cant make a killing with 10-20% of port on memes you wont be able to make a killing with 100% of port

Thats also why Doge and Shiba have not risen so far in this meme run - people are looking to make money not adopt memes

The end of memes this cycle is *probably* more like 10-20 memes going to multi billions and then fading while most are left holding the bag thinking its going much higher then the narrative of memes from this cycle going to 50-100bn as stated by Kols

So if you want to play memes - you put a small % separate to investment port into some low caps that you are ready to lose all on and then its ride or die mentality - thats the way to go

The biggest win so far for Murad is SPX which he bought at 10mc not 500m - Ask yourself if Kols all really really believed memes going to 100bn then why are they personally only looking at sub 200mc memes - its because the R/R and payoff doesnt make sense otherwise in aggregate and the people shilling at 2-3bn MC are the ones that already bought much lower

Traders are different as they just need movements in volatility to make money so they will play every MC but thats a different story",1
"I have never seen this much memecoin bull posting across the board in a while. 

VCs, Traders, anyone still alive on the keyboard. 

Send it. 

@usemoonshot is our normie trojan horse.",0
"i didnt realize how good starlink internet was until i streamed thursday night football in hd on a random flight across the pacific ocean last week

basically as fast as my internet at home lmao

truly one of the greatest technological unlocks of the last decade",0
"Based Rollups

What are they, why do they exist, and which projects are already making waves?

A 101 explainer 👇                                                                                                                                      

==================================

Scaling #Ethereum has been one of the most discussed challenges in crypto.

To address this, the community chose a rollup-centric approach. The idea is simple: Instead of hosting all applications on Ethereum, the focus is on rollups that offer faster, cheaper transactions while still settling back on Ethereum. As a result, you get faster, cheaper transactions, but still keep Ethereum’s security.

We now have optimistic rollups like @Arbitrum, OP Mainnet, and @Base alongside zk-rollups like @ZKsync, all contributing to Ethereum's growth.

They're bringing more users and value to Ethereum, however, concerns remain about their reliance on centralized sequencers and liquidity fragmentation across chains.

This is where based rollups come in. They integrate more closely with Ethereum's infrastructure, helping retain value within the ecosystem. This new method of building rollups could bring additional value to Ethereum and $ETH.

What are Based rollups?
Based rollups, or L1-sequenced rollups, are a type of rollup where the base L1 chain, like Ethereum, manages transaction sequencing directly.

Unlike traditional rollups that rely on their own sequencers, based rollups tap into the security, liveness, and decentralization of the L1 by outsourcing transaction sequencing to the L1’s infrastructure. This infrastructure includes proposers, searchers, builders, and other actors who permissionlessly include based rollup blocks in L1 blocks.

Initially, this approach seemed inefficient — @VitalikButerin once called it ""total anarchy"" in his 2021 article on rollups. But today based rollups have become much more feasible. In 2023, Ethereum researcher @drakefjustin brought the concept back into focus, arguing that based rollups not only align more closely with Ethereum but also eliminate the need for separate security assumptions for each new rollup.

How do Based rollups work?
Based rollups use the L1 for consensus, data availability, and settlement layers, while handling execution independently. For instance, when Ethereum is the base L1, the key layers of based rollups are as follows:

1. Execution Layer — Managed by the rollup itself, where transactions are executed off-chain.

2. Consensus Layer — Relies on Ethereum validators to sequence transactions.

3. Data Availability Layer — Uses Ethereum as the DA layer to ensure that transaction data is available for validation by anyone.

4. Settlement Layer — Also part of Ethereum, where final transaction states of the rollup are recorded.

Based rollups use Ethereum for everything from ordering transactions to settling them. While this approach may not seem radically different from traditional rollups, it fundamentally shifts how sequencing is handled. Instead of relying solely on separate sequencers, based rollups leverage Ethereum itself for transaction sequencing.

In a traditional rollup, users send their transactions to a dedicated sequencer — essentially a single machine operated by the rollup team. This sequencer is responsible for collecting user transactions, determining their sequence, and packaging them into blocks that are posted on Ethereum.

In contrast, based rollups direct user transactions to block builders who manage both Ethereum and the rollup. This use of Ethereum’s infrastructure allows based rollups to benefit from the same guarantees provided by Ethereum, enabling transactions to achieve finality more reliably than in non-based rollups.

Top projects in the based rollup landscape
As a relatively new concept, based rollups are still being developed, with a few key projects emerging:

@taikoxyz — an Ethereum-equivalent (Type 1) ZK-EVM that is maximally compatible with Ethereum and does not introduce additional trust assumptions.

KeySpace — a zk-rollup by @Coinbase aimed at creating smart wallets usable across any chain.

@gwyneth_taiko — a based rollup using pre-confirmations, designed for synchronous composability with Ethereum.

@puffer_unifi — a based rollup developed by the @puffer_finance team that employs pre-confirmations to enhance user experience.

@Spire_Labs — a framework on Ethereum that allows developers to build based appchains.

Why based rollups?
As Justin Drake outlined in his original post, based rollups are worth your attention for several reasons:

1. Inherited Liveness and Decentralization — One of the key advantages of based rollups is their ability to inherit the liveness guarantees of the base L1 chain. As long as the L1 is operational, so is the rollup.

2. Economic Alignment with L1 — The economic model of based rollups creates a mutually beneficial relationship with the L1. Priority fees and MEV from these rollups naturally flows to the L1. This synergy doesn’t just add value to the base layer, it also boosts the legitimacy and brand awareness of the rollups themselves, thanks to Ethereum’s community.

3. Cost Efficiency — Outsourcing sequencing to Ethereum reduces development costs, accelerates time to market, and lowers user costs (especially at scale) for based rollups.

However, based rollups have trade-offs. They sacrifice some profitability by relying on Ethereum for sequencing, missing out on priority fees and MEV. Additionally, they contend with Ethereum's inherent challenges, such as slow block times, which can cause latency issues.

These challenges explain why existing rollups are designed with their own sequencers — to offer a fast user experience. Although solutions like pre-confirmations of inclusion and execution are being discussed as potential ways to enhance the user experience of based rollups, it remains uncertain whether such improvements can be achieved without introducing trusted third parties.

There's a real debate that these changes might compromise the simplicity and security that initially made based rollups appealing.

Analysis by @arjunnchand ✍️",0
"Now tracking @LiskHQ 

Lisk is a Layer 2 network built on the Optimism OP Stack, providing scalability, EVM compatibility, and interoperability. It is part of the Optimism Superchain initiative, offering cost-efficient transactions and shared liquidity across networks https://t.co/DpRHkJeVsH",0
New release of Aave V3 is deployed across all V3 markets and networks 🔥,0
"The necessity for cross-chain interoperability in DeFi is rapidly escalating.

Projects limited to only 1-2 supported networks are no longer viable, given the presence of dozens of L1 chains and over 15 L2 alternatives.

As the ecosystem expands, facilitating secure and efficient asset movement between chains will unveil new prospects.

The upcoming release of the O4DX Bridge by @OrangDx_BRC20 on Oct 9th aims to integrate these cross-chain capabilities into DeFi, paving the way for significant advancements in Web3.

With its emphasis on fast and secure transfers across chains, this innovation represents a pivotal move for the industry.",0
"Puffer finance @puffer_finance is shaping up to be the most comprehensive scaling solution on @ethereum 

They are the only AVS project that:

- Received a grant from the @ethereum foundation

- Funded by top exchanges like @BinanceLabs , @cbventures  @FTI_US and @krakenfx  

- 2nd largest restaking project by TVL (>$1.3B)

Here's everything you need to know about @puffer_finance 
👇

What is Puffer Finance? @puffer_finance 's 3 Core components are

🔹Puffer LRT -> Anti slashing $ETH restaking token powered by @eigenlayer 

🔹Puffer UniFi stack -> The first atomically composed rollup enabling Interoperability between Layer 2 chains and between L1 and L2 chains

🔹The first ever preconfirmation AVS -> delivers close to instant transaction finality on both L1 and L2

Puffer's vision is to solve liquidity fragmentation and UX issues across the @ethereum ecosystem while reviving the $ETH narrative. 

With @puffer_finance 's UniFi AVS as the platform for serving based app-chain solutions with puffer's unique interoperability funtions.

Investors in @puffer_finance include:

🔹Brevan Howard Digital
🔹Binance Labs
🔹Lightspeed ventures
🔹Coinbase Ventures
🔹Franklin Templeton
Kraken Ventures

and many more seed angels like @Rewkang and @sreeramkannan !

They've just unveiled UniFi AVS their revolutionary infrastructure built to solve mission critical problems across @ethereum :

- Pre confirmation technology allows L1 transactions to be completed with sub 0.1 second finality (without changes made to $ETH L1)

- Serious decentralized security backed by $ETH L1

- Empowers any dAPP across Ethereum's ecosystem with UniFi's atomic composability

@puffer_finance solves the issues in the @ethereum ecosystem that matter while aligning with @VitalikButerin 's vision of based rollups

Restake with @puffer_finance at https://t.co/4PmOlgXNRm

You can learn more about @puffer_finance UniFi avs at https://t.co/ocdco94xYd",0
"Hoeflation is the obfuscation of messages on a global stage, hiding away the vital truth of what it constitutes to be human through a fiat currency system and the construction of the idea of housing (a government can and always will be able to take it away from you), of rights, of values, essentially, an open conspiracy where you are Wilson in the chair, locked with wrists shackled against the cold steel while your face is forced to smile against the rats of modernity, screeching, hissing into your eyes, ears and nostrils with the putrid absurdity of it all pushed down your soul till nothing remains but a whisper of what once was, that will never return. 

It is the driving force of inflation and the derivation of value into speculative markets that leads to the gradual collapse of modern society. Technology, AI, all these beautiful new inventions of the 21st century are simply deflationary tools to cover up the collapse, cover up the hysteria brewing, and disguise it all with a veneer of silicon lips and BBL injections as an egirl tells you, “have you registered to vote yet? Your vote COUNTS. YOU count!” 

Yet, most people do not matter. Most people do not count. Such is the efficacy of the bell curve, of odds, of the roll of dice in the lottery of life, where one may be born a cretin or an aristocrat, a pauper or a prince, a royal or a ragamuffin cast to the street. 

Live with a smile, laugh with a grin, while reality scrapes you into the ground with every day passing by, the sun rising and falling, the smog of the city, the chemtrails of the countryside, the electromagnetic screams of the archons reverberating throughout your organism as you wade through the wagedom and serfdom of society. No less, this has been the state of humanity since we fell from the Garden, and found ourselves trading blood, love and youth for the feeble fruit of the ground, or the spilt blood of an animal as it is left to bleed dry before being skinned and gutted for a meal. Souls sacrificed on a conveyor belt of steel and pixelated screens, tax numbers for the long arm of legislation to terrorize and collect their penance due each annum. 

The loss of fertility in modern society is not due to the cost of living, the lack of housing, or even, the lack of familial or cultural support. It is due to a loss of meaning across the board for humanity, the distortion of desire from a silver screen once written before, the sailors fighting in the dancehall, the freakiest show of a clown world, the best selling show where one screams, is there life on Mars? One prays there might be remnants of a past great archaic human civilisation there, remaining in cryogenic suspension with the tools to return to Earth to finish what the better demons of our World Wars could not. 

There is no desire to keep life going, when life is not worth living. There is no desire to preserve culture, when intuitively one knows the culture being preserved has been bastardized, twisted, melded into an Esperanto of farces and illusions, the men chasing the great desire of more, more, MORE, the women placating themselves on cheap dopamine, the children left in an acid vault of brain rot, cottagecore skibidi alpha rizz ohio the Orgy Porgy chant of the 21st century, the carrion call to forget the past, to forget the wisdom written in blood of past wars, to ignore the warning stones of tsunamis and to plant flags upon quicksand and bottomless swamps, crying out, “This is mine! You can’t take it, I OWN it.” 

What is owned on the Earth when in a millennia, few will remember your name? The man that first blew air into a reed to entertain children at candlelight perhaps was the genius that sparked the flame of music, but what was his name? What were the features of his face, the smile he had as a tune emerged from the rudimentary instrument he fashioned likely from the forest surrounding? Vanished into history, erased by time, like tears in the wind, blown across the universe, gone forever.",0
"Now tracking @newtokenmarket on our Fees & Revenue Dashboard

https://t.co/XH4nKNeBxg is a platform that operates across multiple chains in the DeFi space, providing services as a Coin & Token index and voting platform https://t.co/3pIt2axRqs",0
"Bungee was always my go to to bridge aggregator. New protocol sounds cool, basically allows users to perform any action (swap, LP, mint etc) across chains - account abstraction through @SocketProtocol

Check if your wallet has some balls to claim here: https://t.co/DKymCc0nBg",0
"Better to be an optimist and say “how would I feel if I didn’t buy at these prices” than being scared you could be wrong.

The blessing of not having to chase price higher, the relaxation afforded from spot entries lower, the removal of overtrading in the future to play catchup.

There are simply too many technical and psychological positives to ignore buying this region across a range of markets.

Be optimistic, believe in an outcome, manage your risk if you’re wrong, experience the easiest conditions of your life and more profitability than you’ve seen in 12 months if you’re right.",0
"PVP'ing across chains is insane. Both can co-exist. Different ecosystems, different audiences. Who cares??? Fudding one or the other just makes you look insecure. Let them both win. $DMAGA https://t.co/LYn50Ua8Rx",0
"Jotting down a few notes about what I liked about each team at Monad Madness, in the order of presentations.

Feel free to reach out to me if you'd like an intro to any of these teams.

PART 1

@TowneSquarexyz is enabling Dapp Abstraction to meaningfully accelerate the onboarding process for all apps in the Monad ecosystem. Their side-by-side video showing onboarding with and without Townesquare was night and day. In addition to the laser-sharp vision, I liked the team's thoughtfulness and hustle.

@LEVR_bet is bring leveraged sports betting to life. Leveraged sports betting means that users can bet up to 5x leverage; the leverage comes from the fact that odds are monitored in realtime and positions are liquidated if the odds decline too much. Real-time risk management (and the very real-time possibility of liquidation) makes the whole proposition that much more rewarding and engrossing.

@chippedsocial created NFC-chipped press-on nails.  They are building in a massive market (1B/year) and have already captured significant mindshare (3M impressions) while building a product that is unabashedly for women in a space that rarely considers selling to women. I like that there are so many possibilities for further expansion, as the product touches decentralized identity, network creation, and biohacking, while already carving out a niche with high virality and margins.

@Hyperplex_xyz is enabling more capital-efficient and versatile AMMs, where users get better yields as the system identifies opportunities to earn yield from lending assets out to other protocols. Their presentation was crisp and compelling and they nailed the value prop for end users.

@particleink is building an alternate world using AR to create a rich set of interactions and gamified experiences between us and the inhabitants of that world. A variety of gameplay modes and rich visuals immerse the user. I liked that the gameplay is very open and there are a ton of unique angles for user acquisition and feature expansion.

@DrakeExchange is building a 1-click perpetuals DEX with a hybrid order book and AMM model to take on the CEX monopoly. The team implements new features quickly, like order expiries, margin collateral swap, a stablecoin for funding rate arbitrage, to build a feature-rich and slick interface for trading.

@AccountableData is building tools that make bilateral lending and custody safer by enabling proof-of-reserves and accurately tracking collateral and obligations. The team is utilizing the latest tech (currently, TEEs, with plans to add ZKPs) to securely monitor assets on a variety of exchanges and counterparties. I liked that the team hustles hard (36 custom adapters in place already) and has strong founder-market fit, as CEO Wojtek previously launched the credit arm of Maven 11 which issued 1B in loans during the last bull market.

@CadenceProtocol (Symphony) is building a 1-click cross-chain perpetuals aggregator. Users submit an order on one chain, which is split into suborders on different exchanges/chains and executed by solvers. Symphony gives you an AA wallet on every chain so that you have full custody of the position on each chain, while aggregation tools allow you to manage positions individually or in aggregate. I liked the team's thoughtfulness about UX.

@ammalgam is building a Decentralized Lending Exchange (DLEX), which combines an AMM with a lending protocol. In addition to optimizing yield for LPs using lending opportunities, Ammalgam offers exotic payout structures via preset recipes. I liked the team's use of math to construct useful payout primitives.

@Plato2Earn is building a gamified dining experience where eaters, restaurants, and network participants can all collectively win. Eaters get rewards for frequenting local businesses; businesses get user acquisition tools and purchasing data; and Plato diehards can stake on the success of restaurants. I liked the unique angle and the fact that Plato is going after a massive market while being able to play a great ground game focused on individual neighborhoods.

@InfPools is enabling liquidation-free leverage trading, utilizing the familiar model of UniV3-style LPing to allow LPs to sell the right to swap one asset for another at a fixed price. The model allows borrowers to secure a backstop for their levered position in return for paying a funding rate, eliminating the risk of liquidation. I liked the team's clear vision and commitment to heads-down execution over the past two years.

@rethinkablexyz (IntroLink) is helping crypto-natives to 10x their BD by creating a means to request and supply warm introductions. I liked that the team ships very rapidly, building their telegram app in a matter of weeks, and I like the potential for many different angles across BD and recruiting.

Stay tuned for part 2!",0
"$PYTH @PythNetwork currently ranks the highest on @DefiLlama in terms of total traded volume  at >$35b monthly.

They are now sitting at a mindblowing $845 billion total traded volume across all projects that use pyth as their oracle",0
"This is shaping up to be $PYTH’s most impactful quarter yet.

They’re already leading the Oracle space with the highest traded volume ($800B+) among all competitors.

Now, they’ve taken it a step further with Oracle Integrity Staking (OIS).
Here’s what you need to know about it👇

Pyth’s run over the last year has been exceptional.

The network now includes 114 data providers, delivers over 533 price feeds across 75+ blockchains, and secures $8.7B on-chain.

And that’s not all.

According to @DefiLlama, Pyth currently ranks #1 in Oracle traded volume over the past 7 days.

Now, what exactly is OIS?
To put it simply, OIS is a revolutionary mechanism designed to enhance Oracle accuracy and security.

It introduces a strong incentive for both data publishers and stakers to prioritize data integrity by directly tying staking rewards to the precision of price feeds.

Why does this matter? 🤔
In DeFi, the accuracy of oracles can make or break a protocol. $PYTH ensures top-notch reliability.

Stakers and data publishers are penalized for inaccurate data and rewarded for accuracy.

OIS creates a self-regulating ecosystem where only the most reliable price feeds survive.

Learn more about it here -
https://t.co/cUNcKSrZiP

TVS might be a vanity metric based on idle TVL. That’s why Pyth prioritizes TTV (Total Traded Volume), which directly correlates with protocol revenue.

With Pyth powering over 60% of all derivative volume, its revenue share model is set to be a major bullish catalyst for both the protocol and token.

To get started with staking $PYTH, head over to -
https://t.co/WdA6RMCnkI",0
"Isn't it a pain to bridge your assets across 1000s of chains?
 
I came across Bungee, which is launching its Liquidity Marketplace powered by @SocketProtocol.
 
Bungee's solution will eliminate the pains of bridging.
 
Not just that,
 
Bungee Balls campaign is also getting launched with multiple protocols such as Pls change Arbitrum, Kinto, Timeswap, etc.",0
"This week @ournetwork__ co-hosted our first ever Onchain Data Hackathon with @Artemis__xyz  – a one-day chart building contest bringing together data analysts, builders & investors from across the industry.

Coverage on Stablecoins, Layer 2s, Bridging & Staking in ON-277 ⬇️⬇️⬇️

https://t.co/ErEeLhlICz",0
"As part of Aave 2030 and V4, we will focus on optimizing liquidity movements across all network deployments within the Aave markets.",0
"*it's 2009*

somebody tells you there's a digital coin on the internet that lives on a ledger maintained by strangers all using different computers across the globe and claims it will hold value better than the US dollar

if you think ""yes that makes sense"" then you need therapy",0
"As an everyday user of Bungee, I'm super excited to see them push this upgrade.

Bungee's new Liquidity Marketplace will be powered by @SocketProtocol, making it much easier to move across various ecosystems.

Did you claim your Balls? 👀 https://t.co/pC29bevL8W",0
"Trade across every chain/network, all in one UX 😎",0
